{
  "plan": {
    "planId": "0x5ae50229e541ee05486f47308ebab8515d266808d2a03f53e5d40464b48df264",
    "modelVersion": "1",
    "codeHash": "0x4c1ea64a6a81ce2cae7c1aaff36fcdbc64d9b06608471a1d346a9de1e31763ea",
    "nonce": "0",
    "expiry": "1786610660",
    "totalOut": "1000000000000000000000000",
    "reserveAmount": "583491000000000000000000",
    "allocations": [
      {
        "venueId": "0",
        "amount": "84750000000000000000000"
      },
      {
        "venueId": "1",
        "amount": "300000000000000000000000"
      },
      {
        "venueId": "2",
        "amount": "31759000000000000000000"
      }
    ]
  },
  "signature": "0x73a44a574311d90130d1a545746b956627467b273be651d8955671fbc37cad771f5e595449343784aac7a52f4dd9cf6079ac23859f91d0ef72149d86682b6edf1c",
  "inputHash": "0x5ea29a1f240ffd264fd29c7236a5b136f9db639dfad8afe48e52a27ffadb71f8",
  "reasonCodes": [
    {
      "venueId": "0",
      "eligible": true,
      "reason": "eligible"
    },
    {
      "venueId": "1",
      "eligible": true,
      "reason": "eligible"
    },
    {
      "venueId": "2",
      "eligible": true,
      "reason": "eligible"
    }
  ],
  "inputs": {
    "flrUsdValue": "597565",
    "flrUsdDecimals": 8,
    "flrUsdTimestamp": "1786610360",
    "xrpUsdValue": "1011569",
    "xrpUsdDecimals": 6,
    "xrpUsdTimestamp": "1786610360",
    "marketAsOf": "2026-08-13T07:24:00Z",
    "fresh": true,
    "depeg": false
  },
  "attestation": {
    "kind": "simulated-confidential-space",
    "jwt": "eyJhbGciOiJub25lIiwidHlwIjoiSldUIiwia2lkIjoic2ltdWxhdGVkIn0.eyJpc3MiOiJodHRwczovL2NvbmZpZGVudGlhbGNvbXB1dGluZy5nb29nbGVhcGlzLmNvbSIsInN1YiI6InNpbXVsYXRlZC10ZWUtbW9kZWwiLCJod21vZGVsIjoic2ltdWxhdGVkIiwiaW1hZ2VfZGlnZXN0IjoiNGMxZWE2NGE2YTgxY2UyY2FlN2MxYWFmZjM2ZmNkYmM2NGQ5YjA2NjA4NDcxYTFkMzQ2YTlkZTFlMzE3NjNlYSIsInBsYXRmb3JtIjoic2ltdWxhdGVkIn0.stub-not-hardware-verified",
    "claims": {
      "image_digest": "4c1ea64a6a81ce2cae7c1aaff36fcdbc64d9b06608471a1d346a9de1e31763ea",
      "hwmodel": "simulated",
      "platform": "simulated"
    },
    "note": "Attestation is simulated for this PoC. Swap the signer for a tee-node enclave for real attestation; contracts are unchanged."
  }
}
